Data Publicação,Interesse,Título,Link
29/12/2025,Geral,Nota de Esclarecimento,https://www.gov.br/receitafederal/pt-br/assuntos/noticias/2025/dezembro/receita-federal-desmente-fake-news-sobre-taxacoes-a-transacoes-financeiras-a-partir-de-r-5-mil
26/12/2025,Geral,Nota de Esclarecimento,https://www.gov.br/receitafederal/pt-br/assuntos/noticias/2025/dezembro/nota-de-esclarecimento-1
26/12/2025,Empresarial,Receita Federal disponibiliza versão de testes da CBS para adaptação à Reforma Tributária do Consumo,https://www.gov.br/receitafederal/pt-br/assuntos/noticias/2025/dezembro/receita-federal-disponibiliza-versao-de-testes-da-cbs-para-adaptacao-a-reforma-tributaria-do-consumo
26/12/2025,Geral,Receita Federal lança o Programa Aproxime: Fortalecendo a Relação entre o Fisco e a Sociedade,https://www.gov.br/receitafederal/pt-br/assuntos/noticias/2025/dezembro/receita-federal-lanca-o-programa-aproxime-fortalecendo-a-relacao-entre-o-fisco-e-a-sociedade
26/12/2025,Geral,Malha Fiscal Digital: Receita Federal inicia nova edição da operação “Falso Simples”,https://www.gov.br/receitafederal/pt-br/assuntos/noticias/2025/dezembro/malha-fiscal-falso-simples-receita-federal-oferece-nova-oportunidade-de-regularizacao-do-pagamento-de-contribuicao-previdenciaria
26/12/2025,Geral,Receita Federal atualiza legislação para intercâmbio automático de informações a partir de 2027,https://www.gov.br/receitafederal/pt-br/assuntos/noticias/2025/dezembro/receita-federal-atualiza-legislacao-para-intercambio-automatico-de-informacoes-a-partir-de-2027
24/12/2025,Geral,Receita Federal edita norma que regulamenta a atualização de bens móveis e imóveis,https://www.gov.br/receitafederal/pt-br/assuntos/noticias/2025/dezembro/receita-federal-edita-norma-que-regulamenta-a-atualizacao-de-bens-moveis-e-imoveis
24/12/2025,Geral,"Receita Federal publica nova Instrução Normativa sobre parcelamento excepcional de municípios, instituído pela Emenda Constitucional nº 136, de 2025",https://www.gov.br/receitafederal/pt-br/assuntos/noticias/2025/dezembro/receita-federal-publica-nova-instrucao-normativa-sobre-parcelamento-excepcional-de-municipios-instituido-pela-emenda-constitucional-no-136-de-2025
23/12/2025,Geral,Receita Federal adota 50 mil cartinhas da campanha Papai Noel dos Correios com a doação de milhares de brinquedos e outros materiais apreendidos,https://www.gov.br/receitafederal/pt-br/assuntos/noticias/2025/dezembro/receita-federal-adota-50-mil-cartinhas-da-campanha-papai-noel-dos-correios-com-a-doacao-de-milhares-de-brinquedos-e-outros-materiais-apreendidos
23/12/2025,Geral,Programa Gerador da Dmed 2026 disponível para download,https://www.gov.br/receitafederal/pt-br/assuntos/noticias/2025/dezembro/programa-gerador-da-dmed-2026-disponivel-para-download
23/12/2025,Empresarial,Receita Federal e Comitê Gestor do IBS definem regras relativas a obrigações acessórias da Reforma Tributária para início de 2026,https://www.gov.br/receitafederal/pt-br/assuntos/noticias/2025/dezembro/receita-federal-e-comite-gestor-do-ibs-definem-regras-relativas-a-obrigacoes-acessorias-da-reforma-tributaria-para-inicio-de-2026
23/12/2025,Geral,"Receita Federal retém 255,9 kg de substância análoga à maconha na Ponte Internacional da Amizade",https://www.gov.br/receitafederal/pt-br/assuntos/noticias/2025/dezembro/receita-federal-retem-255-9-kg-de-substancia-analoga-a-maconha-na-ponte-internacional-da-amizade
22/12/2025,Empresarial,"Receita Federal esclarece sobre opção da CBS na locação, cessão onerosa ou arrendamento de bem imóvel",https://www.gov.br/receitafederal/pt-br/assuntos/noticias/2025/dezembro/receita-federal-esclarece-sobre-opcao-da-cbs-na-locacao-cessao-onerosa-ou-arrendamento-de-bem-imovel
22/12/2025,Empresarial,Receita Federal mobiliza profissionais da educação para discutir Cidadania Fiscal no currículo escolar em Alagoas,https://www.gov.br/receitafederal/pt-br/assuntos/noticias/2025/dezembro/receita-federal-mobiliza-profissionais-da-educacao-para-discutir-cidadania-fiscal-no-curriculo-escolar-em-alagoas
22/12/2025,Geral,"Receita Federal e Polícia Federal apreendem 212,5kg de cocaína em carga com destino a Portugal no Aeroporto do Recife",https://www.gov.br/receitafederal/pt-br/assuntos/noticias/2025/dezembro/receita-federal-e-policia-federal-apreendem-212-5kg-de-cocaina-em-carga-com-destino-a-portugal-no-aeroporto-do-recife
22/12/2025,Geral,"Ponte da Integração moderniza a fronteira, impulsiona a economia e conta com atuação estratégica da Receita Federal",https://www.gov.br/receitafederal/pt-br/assuntos/noticias/2025/dezembro/ponte-da-integracao-moderniza-a-fronteira-impulsiona-a-economia-e-conta-com-atuacao-estrategica-da-receita-federal
19/12/2025,Geral,Receita Federal comenta nesta segunda-feira (22/12) a arrecadação do mês de novembro e o acumulado do ano,https://www.gov.br/receitafederal/pt-br/assuntos/noticias/2025/dezembro/receita-federal-comenta-nesta-segunda-feira-22-12-a-arrecadacao-do-mes-de-novembro-e-o-acumulado-do-ano
19/12/2025,Geral,Receita Federal e Policia Civil realizam apreensão de refis de cigarros eletrônicos em Natal,https://www.gov.br/receitafederal/pt-br/assuntos/noticias/2025/dezembro/receita-federal-e-policia-civil-realizam-apreensao-de-refis-de-cigarros-eletronicos-em-natal
19/12/2025,Pessoa Física,"Nesta segunda-feira, 22 de dezembro, será aberta a consulta ao lote residual de restituição do IRPF do mês de dezembro/2025",https://www.gov.br/receitafederal/pt-br/assuntos/noticias/2025/dezembro/nesta-segunda-feira-22-de-dezembro-sera-aberta-a-consulta-ao-lote-residual-de-restituicao-do-irpf-do-mes-de-dezembro-2025
18/12/2025,Geral,Publicada a 2ª Edição do “Manual de Atendimentos NAF”,https://www.gov.br/receitafederal/pt-br/assuntos/noticias/2025/dezembro/publicada-a-2a-edicao-do-201cmanual-de-atendimentos-naf201d
18/12/2025,Geral,Receita Federal retém 104 kg de cocaína em terminal privado em Paranaguá,https://www.gov.br/receitafederal/pt-br/assuntos/noticias/2025/dezembro/receita-federal-retem-104-kg-de-cocaina-em-terminal-privado-em-paranagua
18/12/2025,Geral,Nota de Esclarecimento,https://www.gov.br/receitafederal/pt-br/assuntos/noticias/2025/dezembro/nota-de-esclarecimento
18/12/2025,Pessoa Física,Receita Federal orienta sobre os procedimentos para o recolhimento do imposto de renda retido na fonte sobre lucros e dividendos,https://www.gov.br/receitafederal/pt-br/assuntos/noticias/2025/dezembro/receita-federal-orienta-sobre-os-procedimentos-para-o-recolhimento-do-imposto-de-renda-retido-na-fonte-sobre-lucros-e-dividendos
18/12/2025,Geral,Receita Federal atualiza normas relativas ao Imposto sobre a Renda das Pessoas Físicas,https://www.gov.br/receitafederal/pt-br/assuntos/noticias/2025/dezembro/receita-federal-atualiza-normas-relativas-ao-imposto-sobre-a-renda-das-pessoas-fisicas
18/12/2025,Geral,Destinação de mercadorias realizada pela Receita Federal fortalece campanhas de vacinação e doação de sangue em MS,https://www.gov.br/receitafederal/pt-br/assuntos/noticias/2025/dezembro/destinacao-de-mercadorias-realizadas-pela-receita-federal-fortalece-campanhas-de-vacinacao-e-doacao-de-sangue-em-ms
18/12/2025,Geral,Receita Federal atualiza página sobre a Reforma Tributária do Consumo e destaca novas orientações para 2026,https://www.gov.br/receitafederal/pt-br/assuntos/noticias/2025/dezembro/receita-federal-atualiza-pagina-sobre-a-reforma-tributaria-do-consumo-e-destaca-novas-orientacoes-para-2026
18/12/2025,Geral,Receita Federal em Santos apreende quase 600 kg de cocaína,https://www.gov.br/receitafederal/pt-br/assuntos/noticias/2025/dezembro/receita-federal-em-santos-apreende-quase-600-kg-de-cocaina
17/12/2025,Geral,Receita Federal promove mais uma fase da operação Declara Agro no estado de São Paulo,https://www.gov.br/receitafederal/pt-br/assuntos/noticias/2025/dezembro/receita-federal-promove-mais-uma-fase-da-operacao-declara-agro-no-estado-de-sao-paulo
17/12/2025,Geral,Receita Federal reforça papel estratégico na Operação Acolhida,https://www.gov.br/receitafederal/pt-br/assuntos/noticias/2025/dezembro/receita-federal-reforca-papel-estrategico-na-operacao-acolhida
